{

  "$schema": "../schemas/protected_runtime_paths.v1.schema.json",

  "schema_version": "protected_runtime_paths.v1",

  "generated_at": "2026-05-11",

  "policy": "VELA runtime management may know these runtime paths exist and may route user requests to them, but automation must not write, sync, clean, rename, overwrite, install into, remove from, or include them in automatic skill evolution.",

  "paths": [

    {

      "id": "excluded-protected-runtime-boundary",

      "path": "<PROTECTED_RUNTIME_PATH>",

      "owner": "user",

      "purpose": "Placeholder for local protected runtime paths intentionally excluded from the VELA snapshot.",

      "protection_level": "no_touch",

      "allowed_operations": [

        "record_boundary_only"

      ],

      "forbidden_operations": [

        "write",

        "sync",

        "clean",

        "delete",

        "rename",

        "overwrite",

        "install_dependency",

        "auto_evolve",

        "bulk_content_scan",

        "environment_automation_mutation"

      ],

      "reason": "VELA keeps the boundary contract without exporting private path names or excluded skill content."

    }

  ]

}
